{
  "schema_version": "1.0.0",
  "capture": {
    "id": "bedroom_2",
    "tier": "video",
    "device": null,
    "captured_at": null,
    "input_manifest_sha256": "de7ef73b6a2778a564d8d4d5c8877cf858767e22fb79aa4e0013a84c65000f77"
  },
  "run": {
    "pipeline_version": "photo-0.1.0",
    "git_commit": "9bf7b4f2540e8e0e479d8f350340a03f4e44534e",
    "config_sha256": "2d3a55588f25329dee42aabab6704451a69c055b1e89d3ac704f581c142e78e4",
    "seed": 0
  },
  "rooms": [
    {
      "id": "room_01",
      "label": "room",
      "polygon": [
        [
          0.16792036354904089,
          -0.6239994656226331
        ],
        [
          2.304387181650152,
          0.47808626144024957
        ],
        [
          1.1675093590103278,
          2.6819998814616035
        ],
        [
          -0.9689574590907832,
          1.579914154398721
        ]
      ],
      "walls": [
        {
          "id": "w1",
          "start": [
            0.16792036354904089,
            -0.6239994656226331
          ],
          "end": [
            2.304387181650152,
            0.47808626144024957
          ],
          "length_m": {
            "value": 2.403972423852405,
            "ci_low": 1.701092266794102,
            "ci_high": 3.1068525809107084,
            "unit": "m",
            "method": "wall_face_separation",
            "ci_level": 0.95
          },
          "height_m": {
            "value": 2.7,
            "ci_low": 2.2,
            "ci_high": 3.2,
            "unit": "m",
            "method": "prior_no_ceiling_observed",
            "ci_level": 0.95
          }
        },
        {
          "id": "w2",
          "start": [
            2.304387181650152,
            0.47808626144024957
          ],
          "end": [
            1.1675093590103278,
            2.6819998814616035
          ],
          "length_m": {
            "value": 2.479864195500612,
            "ci_low": 1.755297757685789,
            "ci_high": 3.204430633315435,
            "unit": "m",
            "method": "wall_face_separation",
            "ci_level": 0.95
          },
          "height_m": {
            "value": 2.7,
            "ci_low": 2.2,
            "ci_high": 3.2,
            "unit": "m",
            "method": "prior_no_ceiling_observed",
            "ci_level": 0.95
          }
        },
        {
          "id": "w3",
          "start": [
            1.1675093590103278,
            2.6819998814616035
          ],
          "end": [
            -0.9689574590907832,
            1.579914154398721
          ],
          "length_m": {
            "value": 2.403972423852405,
            "ci_low": 1.701092266794102,
            "ci_high": 3.1068525809107084,
            "unit": "m",
            "method": "wall_face_separation",
            "ci_level": 0.95
          },
          "height_m": {
            "value": 2.7,
            "ci_low": 2.2,
            "ci_high": 3.2,
            "unit": "m",
            "method": "prior_no_ceiling_observed",
            "ci_level": 0.95
          }
        },
        {
          "id": "w4",
          "start": [
            -0.9689574590907832,
            1.579914154398721
          ],
          "end": [
            0.16792036354904089,
            -0.6239994656226331
          ],
          "length_m": {
            "value": 2.479864195500612,
            "ci_low": 1.755297757685789,
            "ci_high": 3.204430633315435,
            "unit": "m",
            "method": "wall_face_separation",
            "ci_level": 0.95
          },
          "height_m": {
            "value": 2.7,
            "ci_low": 2.2,
            "ci_high": 3.2,
            "unit": "m",
            "method": "prior_no_ceiling_observed",
            "ci_level": 0.95
          }
        }
      ],
      "ceiling_height_m": {
        "value": 2.7,
        "ci_low": 2.2,
        "ci_high": 3.2,
        "unit": "m",
        "method": "prior_no_ceiling_observed",
        "ci_level": 0.95
      },
      "floor_area_m2": {
        "value": 5.961525140882401,
        "ci_low": 3.4964839595606145,
        "ci_high": 8.426566322204188,
        "unit": "m2",
        "method": "polygon_from_wall_faces",
        "ci_level": 0.95
      },
      "openings": []
    }
  ],
  "adjacency": [],
  "stitched_plan": {
    "placements": [
      {
        "room_id": "room_01",
        "tx": 0.0,
        "ty": 0.0,
        "theta_deg": {
          "value": 0.0,
          "ci_low": -1.0,
          "ci_high": 1.0,
          "unit": "deg",
          "method": "single_world_frame",
          "ci_level": 0.95
        }
      }
    ],
    "footprint_polygon": [
      [
        2.304387181650152,
        0.47808626144024957
      ],
      [
        1.1675093590103278,
        2.6819998814616035
      ],
      [
        -0.9689574590907831,
        1.579914154398721
      ],
      [
        0.16792036354904089,
        -0.623999465622633
      ]
    ],
    "footprint_area_m2": {
      "value": 5.961525140882401,
      "ci_low": 3.4964839595606145,
      "ci_high": 8.426566322204188,
      "unit": "m2",
      "method": "union_of_room_polygons",
      "ci_level": 0.95
    },
    "overlap_area_m2": {
      "value": 0.0,
      "ci_low": 0.0,
      "ci_high": 0.05,
      "unit": "m2",
      "method": "pairwise_polygon_intersection",
      "ci_level": 0.95
    }
  },
  "surfaces": [
    {
      "id": "s_room_01_w1",
      "room_id": "room_01",
      "type": "wall",
      "wall_id": "w1",
      "area_m2": {
        "value": 6.490725544401494,
        "ci_low": 4.244322595380801,
        "ci_high": 8.737128493422187,
        "unit": "m2",
        "method": "wall_length_times_height",
        "ci_level": 0.95
      }
    },
    {
      "id": "s_room_01_w2",
      "room_id": "room_01",
      "type": "wall",
      "wall_id": "w2",
      "area_m2": {
        "value": 6.695633327851653,
        "ci_low": 4.379460566959382,
        "ci_high": 9.011806088743924,
        "unit": "m2",
        "method": "wall_length_times_height",
        "ci_level": 0.95
      }
    },
    {
      "id": "s_room_01_w3",
      "room_id": "room_01",
      "type": "wall",
      "wall_id": "w3",
      "area_m2": {
        "value": 6.490725544401494,
        "ci_low": 4.244322595380801,
        "ci_high": 8.737128493422187,
        "unit": "m2",
        "method": "wall_length_times_height",
        "ci_level": 0.95
      }
    },
    {
      "id": "s_room_01_w4",
      "room_id": "room_01",
      "type": "wall",
      "wall_id": "w4",
      "area_m2": {
        "value": 6.695633327851653,
        "ci_low": 4.379460566959382,
        "ci_high": 9.011806088743924,
        "unit": "m2",
        "method": "wall_length_times_height",
        "ci_level": 0.95
      }
    },
    {
      "id": "s_room_01_floor",
      "room_id": "room_01",
      "type": "floor",
      "wall_id": null,
      "area_m2": {
        "value": 5.961525140882401,
        "ci_low": 3.4964839595606145,
        "ci_high": 8.426566322204188,
        "unit": "m2",
        "method": "polygon_from_wall_faces",
        "ci_level": 0.95
      }
    },
    {
      "id": "s_room_01_ceiling",
      "room_id": "room_01",
      "type": "ceiling",
      "wall_id": null,
      "area_m2": {
        "value": 5.961525140882401,
        "ci_low": 3.4964839595606145,
        "ci_high": 8.426566322204188,
        "unit": "m2",
        "method": "polygon_from_wall_faces",
        "ci_level": 0.95
      }
    }
  ],
  "damage_regions": [],
  "concealed_damage_flags": [],
  "scope_items": [],
  "assumptions": [
    "Single-room fitting: the clip covers one room, so the room is the smallest rectilinear shape containing the whole camera path out to the wall faces found on each side. Sides with no face are closed by that assumption, not measured",
    "Manhattan assumption: walls meet at right angles and are axis aligned after a single global rotation. A curved or 45 degree wall appears as a missing face, not a wrong one",
    "Ceiling height prior 2.2 to 3.2 m used where the ceiling was not observed",
    "All rooms are reconstructed in one world frame, so stitching placements are the identity",
    "Metric scale comes from a monocular depth model given the focal length COLMAP estimated from the same frames; nothing in this tier measured a distance directly",
    "The clip was reconstructed from 24 frames spread across it, chosen for sharpness, through the same engine the photo tier uses. Only the video file was read"
  ],
  "warnings": [
    "Mirror and glass rejection is not available in this build, so a wardrobe mirror can still read as a wall",
    "2 of 4 room sides had no supported wall face (z-, z+); they are closed at the camera path plus 0.45 m by the rectangle assumption and the room is only partially observed",
    "Windows are not detected in this version; openings are doors and pass-throughs only",
    "Ceiling not observed over enough of the floor (coverage 0% < 10%); ceiling height is a prior interval, not a measurement",
    "2 of 4 room sides had no supported wall face (z-, z+); they are closed at the camera path plus 0.45 m by the rectangle assumption and the room is only partially observed",
    "room_01: Ceiling not observed over enough of the floor (coverage 0% < 10%); ceiling height is a prior interval, not a measurement",
    "Damage detection is not implemented; damage_regions, concealed_damage_flags and scope_items are empty"
  ],
  "renders": {
    "plan_png": "plan.png",
    "plan_svg": null
  }
}
